<!-- <build xmlns="https://api.runeduniverse.net/runes4tools/r4m-build-executions" 
	xmlns:xsi="http://www.w3.org/2001/XMLSchema-instance" xsi:schemaLocation="https://api.runeduniverse.net/runes4tools/r4m-build-executions 
	"> -->
<executions
	xmlns="https://api.runeduniverse.net/runes4tools/r4m-build-executions"
	xmlns:xsi="http://www.w3.org/2001/XMLSchema-instance"
	xsi:schemaLocation="https://api.runeduniverse.net/runes4tools/r4m-build-executions r4m-build-executions-v1.xsd">
	<execution id="default">
		<!-- <profiles> -->
		<!-- <profile id="default"></profile> -->
		<!-- <profile id="test"></profile> -->
		<!-- </profiles> -->
		<lifecycles>
			<lifecycle id="clean">
			</lifecycle>
			<lifecycle id="default">
				<phases>
					<phase id="compile">
						<goals>
							<goal id="build-invoker-summary">
								<groupId>net.runeduniverse.tools.runes4tools</groupId>
								<artifactId>runes4maven-maven-plugin</artifactId>
								<fork>
									<lifecycle id="builder">
										<executions>
											<execution>default</execution>
										</executions>
									</lifecycle>
								</fork>
							</goal>
						</goals>
					</phase>
					<phase id="test-compile">
						<goals>
							<goal id="build-invoker-summary">
								<groupId>net.runeduniverse.tools.runes4tools</groupId>
								<artifactId>runes4maven-maven-plugin</artifactId>
								<fork>
									<lifecycle id="builder">
										<executions>
											<execution>test</execution>
										</executions>
									</lifecycle>
								</fork>
							</goal>
						</goals>
					</phase>
				</phases>
			</lifecycle>
			<lifecycle id="site">
			</lifecycle>
		</lifecycles>
	</execution>
</executions>